{
  "$ref": "#/definitions/enabler",
  "definitions": {
    "enabler": {
      "type": "object",
      "properties": {
        "name": {
          "type": "string"
        },
        "bio": {
          "type": "string"
        },
        "image": {
          "type": "string"
        },
        "posts": {
          "type": "array",
          "items": {
            "type": "object",
            "properties": {
              "type": {
                "type": "string",
                "enum": [
                  "twitter"
                ]
              },
              "href": {
                "type": "string"
              },
              "text": {
                "type": "string"
              },
              "date": {
                "type": "string"
              },
              "image": {
                "type": "string"
              },
              "imageCaption": {
                "type": "string"
              },
              "commentary": {
                "type": "string"
              },
              "tags": {
                "type": "array",
                "items": {
                  "type": "string",
                  "enum": [
                    "dehumanisation",
                    "discrimination",
                    "incitement",
                    "polarisation",
                    "denial"
                  ]
                }
              },
              "quote": {
                "type": "object",
                "properties": {
                  "text": {
                    "type": "string"
                  },
                  "author": {
                    "type": "string"
                  },
                  "image": {
                    "type": "string"
                  },
                  "imageCaption": {
                    "type": "string"
                  }
                },
                "required": [
                  "text",
                  "author"
                ],
                "additionalProperties": false
              }
            },
            "required": [
              "type",
              "href",
              "date",
              "tags"
            ],
            "additionalProperties": false
          }
        }
      },
      "required": [
        "name",
        "bio",
        "posts"
      ],
      "additionalProperties": false
    }
  },
  "$schema": "http://json-schema.org/draft-07/schema#"
}